{
  "schema_version": 3,
  "record_type": "design-dna-route-verification",
  "status": "passed",
  "verified_at": "2026-09-06T16:54:30.786618Z",
  "canonical": "skills/design-dna",
  "scan_scope": {
    "basis": "explicit-filesystem-root-scan",
    "root_scope": "explicit-roots-only",
    "activation_state": "not-verified",
    "project_admin_session_routes": "not-inspected",
    "limitations": [
      "A discovered SKILL.md is a filesystem discovery candidate, not proof that a host activated it.",
      "Roots not passed with --root, including project-local, administrator-managed, and session-specific routes, were not scanned."
    ]
  },
  "roots": [
    "~/.agents/skills",
    "~/.claude/plugins/cache",
    "~/.claude/skills",
    "~/.codex/plugins/cache",
    "~/.codex/skills"
  ],
  "expected": [
    "~/.agents/skills/design-dna",
    "~/.claude/skills/design-dna"
  ],
  "canonical_sha256": "5fee085c44345cdcf74df52a9fa9d3360069d848a451a2be3621850a3658f79a",
  "routes": [
    {
      "path": "~/.agents/skills/design-dna",
      "content_sha256": "5fee085c44345cdcf74df52a9fa9d3360069d848a451a2be3621850a3658f79a",
      "matches_canonical": true
    },
    {
      "path": "~/.claude/skills/design-dna",
      "content_sha256": "5fee085c44345cdcf74df52a9fa9d3360069d848a451a2be3621850a3658f79a",
      "matches_canonical": true
    }
  ]
}
